post_text,likes,comments,shares,post_time,post_link
"This is where you can have it all 💪 Enjoy not only a healthy habit,  but a brand new healthy lifestyle,  all in Gold's Gym Alexandria Club 💪 Join us now and feel the luxury of working out 💪 Experience the power of innovation with Gym80 – now at Gold’s Gym! Train with the latest state-of-the-art equipment designed for maximum performance and results...#GoldsGymClub#Gym80#TrainSmart#NextLevelFitness#StateOfTheArt#FitnessInnovation#StrengthTraining#PowerYourWorkout#AlexandriaFitness#GoldsGymEgypt Where every workout feels different. Find your favorite class at Gold’s Gym Club. More than a workout… it’s a luxury experience .. join now",,,,pSnteodosriafii01tut46081J0lf426nelc58mi29ht03u2u41:5837t,https://www.facebook.com/GoldsGymAlexClub/posts/pfbid0mZ42LC8yhwKDhMTtJiq8fr6NFoDeM4P9x64uYASsZJqoes2hjiVnAxt4PRJpLFyUl
More than a workout… it’s a luxury experience .. join now,,,,trodsoSpneti:a374gJn2297l8t146u90fe09t17a84mm66t0386i4t3c,https://www.facebook.com/reel/1690731722185064
"Train in luxury, Feel the difference join now!",,,,trodsoSpneti:a774gJn2297l8t146u90fe09t17a84mm66t0346i4t3c,https://www.facebook.com/reel/1135933812941861
"Where everything you need to feel stronger, healthier, and better is all in one place—Gold’s Gym Club, your second home.",,,,trodsoSpneti:a274gJn2197l8t146u90fe09t13a84mm66t0386i1t3c,https://www.facebook.com/reel/1364730015532318
The June GGX Schedule is here! Get stronger and more energetic by exploring our new schedule and finding your perfect class.,,,,pSnsrootedy49722391h103g31lu2h75mi9il4u85a3a1iM9t546fc72296,https://www.facebook.com/GoldsGymAlexClub/posts/pfbid026xMUkUvjdCv5i2XmxwPxoBWwqkJmWnZ8ce9hGkjoLxZadm4msErUFXx2rS4EAdtzl
